{
	"$schema": "https://json-schema.org/draft/2020-12/schema",
	"$id": "cex-market-data-preparation-product-pin/v1",
	"title": "CEX market-data preparation product pin v1",
	"type": "object",
	"additionalProperties": false,
	"required": [
		"schema_id",
		"package",
		"executables",
		"schema_manifest",
		"schema_pins",
		"capability_policy",
		"resource_policy"
	],
	"properties": {
		"schema_id": { "const": "cex-market-data-preparation-product-pin/v1" },
		"package": {
			"type": "object",
			"additionalProperties": false,
			"required": [
				"name",
				"version",
				"registry_tarball_url",
				"integrity",
				"tarball_sha256",
				"npm_git_head"
			],
			"properties": {
				"name": { "const": "@usherlabs/cex-broker" },
				"version": { "$ref": "#/$defs/semver" },
				"registry_tarball_url": {
					"type": "string",
					"pattern": "^https://registry\\.npmjs\\.org/@usherlabs/cex-broker/-/cex-broker-[0-9A-Za-z.-]+\\.tgz$"
				},
				"integrity": {
					"type": "string",
					"pattern": "^sha512-[A-Za-z0-9+/]+={0,2}$"
				},
				"tarball_sha256": { "$ref": "#/$defs/sha256" },
				"npm_git_head": { "type": "string", "pattern": "^[0-9a-f]{40}$" }
			}
		},
		"executables": {
			"type": "array",
			"minItems": 2,
			"maxItems": 2,
			"items": {
				"type": "object",
				"additionalProperties": false,
				"required": [
					"product_id",
					"product_version",
					"relative_path",
					"executable_sha256"
				],
				"properties": {
					"product_id": {
						"enum": [
							"market-data-vendor-backfill",
							"cex-canonical-orderbook-export"
						]
					},
					"product_version": {
						"enum": [
							"market-data-vendor-backfill/v1",
							"cex-canonical-orderbook-export/v1"
						]
					},
					"relative_path": {
						"type": "string",
						"pattern": "^dist/commands/[A-Za-z0-9._-]+\\.js$"
					},
					"executable_sha256": { "$ref": "#/$defs/sha256" }
				}
			}
		},
		"schema_manifest": {
			"type": "object",
			"additionalProperties": false,
			"required": ["schema_id", "manifest_sha256", "relative_path"],
			"properties": {
				"schema_id": {
					"const": "https://schemas.usher.so/market-data-vendor-backfill-schema-manifest/v2"
				},
				"manifest_sha256": { "$ref": "#/$defs/sha256" },
				"relative_path": {
					"const": "dist/market-data-preparation/schema-manifest.json"
				}
			}
		},
		"schema_pins": {
			"type": "array",
			"minItems": 8,
			"maxItems": 8,
			"uniqueItems": true,
			"items": {
				"type": "object",
				"additionalProperties": false,
				"required": ["schema_id", "schema_sha256"],
				"properties": {
					"schema_id": { "type": "string", "minLength": 1, "maxLength": 256 },
					"schema_sha256": { "$ref": "#/$defs/sha256" }
				}
			}
		},
		"capability_policy": { "$ref": "#/$defs/policyPin" },
		"resource_policy": { "$ref": "#/$defs/policyPin" }
	},
	"$defs": {
		"sha256": { "type": "string", "pattern": "^[0-9a-f]{64}$" },
		"semver": {
			"type": "string",
			"pattern": "^[0-9]+\\.[0-9]+\\.[0-9]+(?:-[0-9A-Za-z.-]+)?$"
		},
		"policyPin": {
			"type": "object",
			"additionalProperties": false,
			"required": ["policy_id", "policy_sha256"],
			"properties": {
				"policy_id": { "type": "string", "minLength": 1, "maxLength": 256 },
				"policy_sha256": { "$ref": "#/$defs/sha256" }
			}
		}
	}
}
