{
	"schema_id": "cex-market-data-preparation-product-pin/v1",
	"package": {
		"name": "@usherlabs/cex-broker",
		"version": "0.2.48",
		"registry_tarball_url": "https://registry.npmjs.org/@usherlabs/cex-broker/-/cex-broker-0.2.48.tgz",
		"integrity": "sha512-Zapa/tRmJMTvjDn0EWw3fGTTtpe8BqUeEwqPapjYE1onWxa610ovRRfPIX5k0pfSR2fz8ujy0zY+JcKxKWNSFw==",
		"tarball_sha256": "58968a3882fde77540ea12c3182681c36c33e4b6d815113e3173a54f4045caf5",
		"npm_git_head": "3b42f32422c587afbdfab6ed16b0969980eaaddb"
	},
	"executables": [
		{
			"product_id": "market-data-vendor-backfill",
			"product_version": "market-data-vendor-backfill/v1",
			"relative_path": "dist/commands/market-data-vendor-backfill.js",
			"executable_sha256": "793a51c317b0f9e4a6e9710075c5876b04452768421c8f0c98b77e0489d7f8e3"
		},
		{
			"product_id": "cex-canonical-orderbook-export",
			"product_version": "cex-canonical-orderbook-export/v1",
			"relative_path": "dist/commands/cex-canonical-orderbook-export.js",
			"executable_sha256": "47b5a9281acbaf2139b7eb449622448c9ad74aa2ce286b8f1c16a51d5458ec2f"
		}
	],
	"schema_manifest": {
		"schema_id": "https://schemas.usher.so/market-data-vendor-backfill-schema-manifest/v2",
		"manifest_sha256": "0e226165c78c6217a765c09be15b6305a574e69b6e05e8607f399b468ba04d5b",
		"relative_path": "dist/market-data-preparation/schema-manifest.json"
	},
	"schema_pins": [
		{
			"schema_id": "https://schemas.usher.so/market-data-vendor-backfill-request/v1",
			"schema_sha256": "94eea61421e2dbbb77a583d60aa18208debee31bb7284b0a57e844d8ff34e0ad"
		},
		{
			"schema_id": "https://schemas.usher.so/market-data-vendor-backfill-result/v2",
			"schema_sha256": "31d9768cc34d2b46c4e6e98428dbacb066429d412679f21fea331908db556df4"
		},
		{
			"schema_id": "https://schemas.usher.so/market-data-vendor-backfill-required-clock/v1",
			"schema_sha256": "9f850ddb07aaf4cd339ce60e8c54f80313a090bed1a30c82a6db5877c9b4fbf3"
		},
		{
			"schema_id": "https://schemas.usher.so/market-data-vendor-backfill-archive-selection/v1",
			"schema_sha256": "1c76ee8579abdaa6f060a14361ed8fe1a93dcf484418b91eede9210d88f99aea"
		},
		{
			"schema_id": "https://schemas.usher.so/market-data-vendor-backfill-promotion-receipt/v1",
			"schema_sha256": "00c42aba3e4a26d4692ef5554273ed762c21fce8c07624bc970ff0b28884b099"
		},
		{
			"schema_id": "https://schemas.usher.so/cex-canonical-orderbook-export-request/v1",
			"schema_sha256": "50a698628b00204c927e28d8c7048345330fb17ab61f86addd3a04114debc0f3"
		},
		{
			"schema_id": "https://schemas.usher.so/cex-canonical-orderbook-export-result/v1",
			"schema_sha256": "77da86c140474294bfc351be6a3a69c57fff95032e9bafa9aaa09d398315cd3c"
		},
		{
			"schema_id": "cex-market-data-preparation-product-pin/v1",
			"schema_sha256": "7e50cf70aaa87fc608647dfc71e61f18c3da05f27f1f6ceba4c58bc960ff88ff"
		}
	],
	"capability_policy": {
		"policy_id": "market-data-vendor-backfill-capabilities/v1",
		"policy_sha256": "51f522286ad24ec55525c19cad5c2c37043f9325a5a8f20d838adb7fd71191bf"
	},
	"resource_policy": {
		"policy_id": "market-data-vendor-backfill-resources/v1",
		"policy_sha256": "38d4f47cbd15794efed570801556a95f724561a8b45567d518c044da9d454142"
	}
}
